<?xml version="1.0" encoding="UTF-8"?>

<xs:schema xmlns:xs="http://www.w3.org/2001/XMLSchema" targetNamespace="http://www.swordsandsorcery.com/item"
           xmlns="http://www.swordsandsorcery.com/item" elementFormDefault="qualified">
    <xs:element name="item">
        <xs:complexType>
            <xs:all>
                <xs:element name="id" type="xs:unsignedInt" minOccurs="1"/>
                <xs:element name="name" type="xs:string" minOccurs="1"/>
                <xs:element name="type" minOccurs="1">
                    <xs:simpleType>
                        <xs:restriction base="xs:string">
                            <xs:enumeration value="ONE_HANDED_SWORD"/>
                            <xs:enumeration value="SHIELD"/>
                        </xs:restriction>
                    </xs:simpleType>
                </xs:element>
                <xs:element name="weight" type="xs:unsignedInt"/>
                <xs:element name="modifiers">
                    <xs:complexType>
                        <xs:sequence>
                            <xs:element name="modifier" maxOccurs="unbounded">
                                <xs:complexType>
                                    <xs:sequence>
                                        <xs:element name="target" minOccurs="1" maxOccurs="1">
                                            <xs:simpleType>
                                                <xs:restriction base="xs:string">
                                                    <xs:enumeration value="ATTACK"/>
                                                    <xs:enumeration value="DEFENSE"/>
                                                    <xs:enumeration value="INITIATION"/>
                                                </xs:restriction>
                                            </xs:simpleType>
                                        </xs:element>
                                        <xs:element name="value" type="xs:integer" minOccurs="1" maxOccurs="1"/>
                                    </xs:sequence>
                                </xs:complexType>
                            </xs:element>
                        </xs:sequence>
                    </xs:complexType>
                </xs:element>
            </xs:all>
        </xs:complexType>
    </xs:element>
</xs:schema>